root@COMP3134-2025:~# tcpdump -c 5 -i eth0
tcpdump: verbose output suppressed, use -v[v]... for full protocol decode
listening on eth0, link-type EN10MB (Ethernet), snapshot length 262144 bytes
20:38:04.532251 IP COMP3134-2025.ssh > 162.243.188.66.11788: Flags [P.], seq 1723819700:1723819828, ack 3081661544, win 501, options [nop,nop,TS val 3964063805 ecr 3082019730], length 128
20:38:04.532318 IP COMP3134-2025.ssh > 162.243.188.66.11788: Flags [P.], seq 128:192, ack 1, win 501, options [nop,nop,TS val 3964063805 ecr 3082019730], length 64
20:38:04.532343 IP COMP3134-2025.ssh > 162.243.188.66.11788: Flags [P.], seq 192:272, ack 1, win 501, options [nop,nop,TS val 3964063805 ecr 3082019730], length 80
20:38:04.532390 IP COMP3134-2025.ssh > 162.243.188.66.11788: Flags [P.], seq 272:432, ack 1, win 501, options [nop,nop,TS val 3964063805 ecr 3082019730], length 160
20:38:04.532420 IP COMP3134-2025.ssh > 162.243.188.66.11788: Flags [P.], seq 432:496, ack 1, win 501, options [nop,nop,TS val 3964063805 ecr 3082019730], length 64
5 packets captured
47 packets received by filter
10 packets dropped by kernel
root@COMP3134-2025:~# 