20:53:20.027028 IP COMP3134-2025.ssh > 162.243.188.66.11788: Flags [P.], seq 67408:67936, ack 1, win 501, options [nop,nop,TS val 3964979300 ecr 3082935187], length 528
20:53:20.027099 IP COMP3134-2025.ssh > 162.243.188.66.11788: Flags [P.], seq 67936:68464, ack 1, win 501, options [nop,nop,TS val 3964979300 ecr 3082935187], length 528
20:53:20.027170 IP COMP3134-2025.ssh > 162.243.188.66.11788: Flags [P.], seq 68464:68992, ack 1, win 501, options [nop,nop,TS val 3964979300 ecr 3082935187], length 528
20:53:20.027241 IP COMP3134-2025.ssh > 162.243.188.66.11788: Flags [P.], seq 68992:69520, ack 1, win 501, options [nop,nop,TS val 3964979300 ecr 3082935187], length 528
20:53:20.027302 IP COMP3134-2025.ssh > 162.243.188.66.11788: Flags [P.], seq 69520:69888, ack 1, win 501, options [nop,nop,TS val 3964979300 ecr 3082935187], length 368
20:53:20.027372 IP COMP3134-2025.ssh > 162.243.188.66.11788: Flags [P.], seq 69888:70416, ack 1, win 501, options [nop,nop,TS val 3964979300 ecr 3082935187], length 528
20:53:20.027427 IP COMP3134-2025.ssh > 162.243.188.66.11788: Flags [P.], seq 70416:70624, ack 1, win 501, options [nop,nop,TS val 3964979300 ecr 3082935187], length 208
20:53:20.040693 IP 162.243.188.66.11788 > COMP3134-2025.ssh: Flags [.], ack 63728, win 4978, options [nop,nop,TS val 3082935249 ecr 3964979299], length 0
20:53:20.040837 IP 162.243.188.66.11788 > COMP3134-2025.ssh: Flags [.], ack 65024, win 4978, options [nop,nop,TS val 3082935249 ecr 3964979299], length 0
20:53:20.040916 IP 162.243.188.66.11788 > COMP3134-2025.ssh: Flags [.], ack 66320, win 4978, options [nop,nop,TS val 3082935250 ecr 3964979299], length 0
20:53:20.041051 IP 162.243.188.66.11788 > COMP3134-2025.ssh: Flags [.], ack 67408, win 4978, options [nop,nop,TS val 3082935250 ecr 3964979299], length 0
20:53:20.041201 IP 162.243.188.66.11788 > COMP3134-2025.ssh: Flags [.], ack 68464, win 4978, options [nop,nop,TS val 3082935250 ecr 3964979300], length 0
20:53:20.041361 IP 162.243.188.66.11788 > COMP3134-2025.ssh: Flags [.], ack 69520, win 4978, options [nop,nop,TS val 3082935250 ecr 3964979300], length 0
20:53:20.041489 IP 162.243.188.66.11788 > COMP3134-2025.ssh: Flags [.], ack 70416, win 4978, options [nop,nop,TS val 3082935250 ecr 3964979300], length 0
20:53:20.079904 IP 162.243.188.66.11788 > COMP3134-2025.ssh: Flags [.], ack 70624, win 4978, options [nop,nop,TS val 3082935289 ecr 3964979300], length 0
20:53:20.130350 IP COMP3134-2025.ssh > 162.243.188.66.11788: Flags [P.], seq 70624:70848, ack 1, win 501, options [nop,nop,TS val 3964979403 ecr 3082935289], length 224
20:53:20.130509 IP COMP3134-2025.ssh > 162.243.188.66.11788: Flags [P.], seq 70848:72096, ack 1, win 501, options [nop,nop,TS val 3964979403 ecr 3082935289], length 1248
20:53:20.130591 IP COMP3134-2025.ssh > 162.243.188.66.11788: Flags [P.], seq 72096:72832, ack 1, win 501, options [nop,nop,TS val 3964979403 ecr 3082935289], length 736
20:53:20.130658 IP COMP3134-2025.ssh > 162.243.188.66.11788: Flags [P.], seq 72832:73392, ack 1, win 501, options [nop,nop,TS val 3964979403 ecr 3082935289], length 560
20:53:20.130724 IP COMP3134-2025.ssh > 162.243.188.66.11788: Flags [P.], seq 73392:73920, ack 1, win 501, options [nop,nop,TS val 3964979403 ecr 3082935289], length 528
20:53:20.130789 IP COMP3134-2025.ssh > 162.243.188.66.11788: Flags [P.], seq 73920:74448, ack 1, win 501, options [nop,nop,TS val 3964979403 ecr 3082935289], length 528
20:53:20.130863 IP COMP3134-2025.ssh > 162.243.188.66.11788: Flags [P.], seq 74448:74816, ack 1, win 501, options [nop,nop,TS val 3964979403 ecr 3082935289], length 368