root@COMP3134-2025:~# tcpdump -i eth0
tcpdump: verbose output suppressed, use -v[v]... for full protocol decode
listening on eth0, link-type EN10MB (Ethernet), snapshot length 262144 bytes
20:34:41.033683 IP COMP3134-2025.ssh > 162.243.188.66.11788: Flags [P.], seq 1723794420:1723794548, ack 3081660984, win 501, options [nop,nop,TS val 3963860306 ecr 3081816233], length 128
20:34:41.033741 IP COMP3134-2025.ssh > 162.243.188.66.11788: Flags [P.], seq 128:192, ack 1, win 501, options [nop,nop,TS val 3963860306 ecr 3081816233], length 64
20:34:41.033776 IP COMP3134-2025.ssh > 162.243.188.66.11788: Flags [P.], seq 192:272, ack 1, win 501, options [nop,nop,TS val 3963860306 ecr 3081816233], length 80
20:34:41.033809 IP COMP3134-2025.ssh > 162.243.188.66.11788: Flags [P.], seq 272:352, ack 1, win 501, options [nop,nop,TS val 3963860306 ecr 3081816233], length 80
20:34:41.033840 IP COMP3134-2025.ssh > 162.243.188.66.11788: Flags [P.], seq 352:432, ack 1, win 501, options [nop,nop,TS val 3963860306 ecr 3081816233], length 80
20:34:41.033869 IP COMP3134-2025.ssh > 162.243.188.66.11788: Flags [P.], seq 432:496, ack 1, win 501, options [nop,nop,TS val 3963860306 ecr 3081816233], length 64
20:34:41.037570 IP 162.243.188.66.11788 > COMP3134-2025.ssh: Flags [.], ack 0, win 501, options [nop,nop,TS val 3081816248 ecr 3963860296], length 0
20:34:41.047980 IP 162.243.188.66.11788 > COMP3134-2025.ssh: Flags [.], ack 128, win 501, options [nop,nop,TS val 3081816258 ecr 3963860306], length 0
20:34:41.048026 IP 162.243.188.66.11788 > COMP3134-2025.ssh: Flags [.], ack 192, win 501, options [nop,nop,TS val 3081816258 ecr 3963860306], length 0
20:34:41.048047 IP 162.243.188.66.11788 > COMP3134-2025.ssh: Flags [.], ack 272, win 501, options [nop,nop,TS val 3081816258 ecr 3963860306], length 0
20:34:41.048143 IP 162.243.188.66.11788 > COMP3134-2025.ssh: Flags [.], ack 352, win 501, options [nop,nop,TS val 3081816258 ecr 3963860306], length 0
20:34:41.048143 IP 162.243.188.66.11788 > COMP3134-2025.ssh: Flags [.], ack 432, win 501, options [nop,nop,TS val 3081816258 ecr 3963860306], length 0
20:34:41.048143 IP 162.243.188.66.11788 > COMP3134-2025.ssh: Flags [.], ack 496, win 501, options [nop,nop,TS val 3081816259 ecr 3963860306], length 0
20:34:41.135040 IP COMP3134-2025.35526 > 67.207.67.2.domain: 23546+ [1au] PTR? 66.188.243.162.in-addr.arpa. (56)
20:34:41.135149 IP COMP3134-2025.36627 > 67.207.67.2.domain: 29346+ [1au] PTR? 66.188.243.162.in-addr.arpa. (56)
20:34:41.382784 IP 67.207.67.2.domain > COMP3134-2025.36627: 29346 NXDomain 0/1/1 (123)
20:34:41.382785 IP 67.207.67.2.domain > COMP3134-2025.35526: 23546 NXDomain 0/1/1 (123)
20:34:41.382946 IP COMP3134-2025.36627 > 67.207.67.2.domain: 29346+ PTR? 66.188.243.162.in-addr.arpa. (45)
20:34:41.383114 IP COMP3134-2025.35526 > 67.207.67.2.domain: 23546+ PTR? 66.188.243.162.in-addr.arpa. (45)
20:34:41.417764 IP 67.207.67.2.domain > COMP3134-2025.36627: 29346 NXDomain 0/1/0 (112)
20:34:41.418573 IP 67.207.67.2.domain > COMP3134-2025.35526: 23546 NXDomain 0/1/0 (112)