root@COMP3134-2025:~# tcpdump -r 0001.pcap
reading from file 0001.pcap, link-type EN10MB (Ethernet), snapshot length 262144
20:46:37.417606 IP COMP3134-2025.ssh > 162.243.188.66.11788: Flags [P.], seq 1732238276:1732238340, ack 3081666168, win 501, options [nop,nop,TS val 3964576690 ecr 3082532620], length 64
20:46:37.417660 IP COMP3134-2025.ssh > 162.243.188.66.11788: Flags [P.], seq 64:144, ack 1, win 501, options [nop,nop,TS val 3964576690 ecr 3082532620], length 80
20:46:37.417703 IP COMP3134-2025.ssh > 162.243.188.66.11788: Flags [P.], seq 144:224, ack 1, win 501, options [nop,nop,TS val 3964576690 ecr 3082532620], length 80
20:46:37.417736 IP COMP3134-2025.ssh > 162.243.188.66.11788: Flags [P.], seq 224:304, ack 1, win 501, options [nop,nop,TS val 3964576690 ecr 3082532620], length 80
20:46:37.417765 IP COMP3134-2025.ssh > 162.243.188.66.11788: Flags [P.], seq 304:368, ack 1, win 501, options [nop,nop,TS val 3964576690 ecr 3082532620], length 64
20:46:37.428360 IP 162.243.188.66.11788 > COMP3134-2025.ssh: Flags [.], ack 0, win 4978, options [nop,nop,TS val 3082532637 ecr 3964576687], length 0
20:46:37.431765 IP 162.243.188.66.11788 > COMP3134-2025.ssh: Flags [.], ack 64, win 4978, options [nop,nop,TS val 3082532640 ecr 3964576690], length 0
20:46:37.431808 IP 162.243.188.66.11788 > COMP3134-2025.ssh: Flags [.], ack 144, win 4978, options [nop,nop,TS val 3082532640 ecr 3964576690], length 0
20:46:37.431834 IP 162.243.188.66.11788 > COMP3134-2025.ssh: Flags [.], ack 224, win 4978, options [nop,nop,TS val 3082532640 ecr 3964576690], length 0
20:46:37.431843 IP 162.243.188.66.11788 > COMP3134-2025.ssh: Flags [.], ack 304, win 4978, options [nop,nop,TS val 3082532640 ecr 3964576690], length 0
20:46:37.431853 IP 162.243.188.66.11788 > COMP3134-2025.ssh: Flags [.], ack 368, win 4978, options [nop,nop,TS val 3082532640 ecr 3964576690], length 0
20:46:39.394386 IP 167.94.146.43.20148 > COMP3134-2025.25953: Flags [S], seq 4222175469, win 42340, options [mss 1460,sackOK,TS val 1738441061 ecr 0,nop,wscale 10], length 0
20:46:45.717790 IP 52.169.25.196.39274 > COMP3134-2025.ssh: Flags [S], seq 2674823286, win 64240, options [mss 1440,sackOK,TS val 2389144965 ecr 0,nop,wscale 7], length 0
20:46:45.717884 IP COMP3134-2025.ssh > 52.169.25.196.39274: Flags [S.], seq 237186779, ack 2674823287, win 65160, options [mss 1460,sackOK,TS val 241737856 ecr 2389144965,nop,wscale 7], length 0
20:46:45.799495 IP 52.169.25.196.39274 > COMP3134-2025.ssh: Flags [.], ack 1, win 502, options [nop,nop,TS val 2389145047 ecr 241737856], length 0
20:46:45.809704 IP COMP3134-2025.ssh > 52.169.25.196.39274: Flags [P.], seq 1:43, ack 1, win 510, options [nop,nop,TS val 241737948 ecr 2389145047], length 42: SSH: SSH-2.0-OpenSSH_8.9p1 Ubuntu-3ubuntu0.10
20:46:45.892989 IP 52.169.25.196.39274 > COMP3134-2025.ssh: Flags [.], ack 43, win 502, options [nop,nop,TS val 2389145140 ecr 241737948], length 0
20:46:46.142069 IP 52.169.25.196.39274 > COMP3134-2025.ssh: Flags [P.], seq 1:13, ack 43, win 502, options [nop,nop,TS val 2389145390 ecr 241737948], length 12: SSH: SSH-2.0-Go
20:46:46.142070 IP 52.169.25.196.39274 > COMP3134-2025.ssh: Flags [P.], seq 13:1133, ack 43, win 502, options [nop,nop,TS val 2389145390 ecr 241737948], length 1120
20:46:46.142141 IP COMP3134-2025.ssh > 52.169.25.196.39274: Flags [.], ack 13, win 510, options [nop,nop,TS val 241738281 ecr 2389145390], length 0
20:46:46.142162 IP COMP3134-2025.ssh > 52.169.25.196.39274: Flags [.], ack 1133, win 502, options [nop,nop,TS val 241738281 ecr 2389145390], length 0
20:46:46.144017 IP COMP3134-2025.ssh > 52.169.25.196.39274: Flags [P.], seq 43:1155, ack 1133, win 502, options [nop,nop,TS val 241738283 ecr 2389145390], length 1112
20:46:46.229392 IP 52.169.25.196.39274 > COMP3134-2025.ssh: Flags [.], ack 1155, win 524, options [nop,nop,TS val 2389145478 ecr 241738283], length 0
20:46:46.295098 IP 52.169.25.196.39274 > COMP3134-2025.ssh: Flags [P.], seq 1133:1181, ack 1155, win 524, options [nop,nop,TS val 2389145543 ecr 241738283], length 48
20:46:46.299955 IP COMP3134-2025.ssh > 52.169.25.196.39274: Flags [P.], seq 1155:1759, ack 1181, win 502, options [nop,nop,TS val 241738438 ecr 2389145543], length 604
20:46:46.379133 IP 52.169.25.196.39274 > COMP3134-2025.ssh: Flags [.], ack 1759, win 541, options [nop,nop,TS val 2389145627 ecr 241738438], length 0
20:46:46.415525 IP 52.169.25.196.39274 > COMP3134-2025.ssh: Flags [P.], seq 1181:1197, ack 1759, win 541, options [nop,nop,TS val 2389145664 ecr 241738438], length 16
20:46:46.415526 IP 52.169.25.196.39274 > COMP3134-2025.ssh: Flags [P.], seq 1197:1249, ack 1759, win 541, options [nop,nop,TS val 2389145664 ecr 241738438], length 52
20:46:46.415632 IP COMP3134-2025.ssh > 52.169.25.196.39274: Flags [.], ack 1249, win 502, options [nop,nop,TS val 241738554 ecr 2389145664], length 0
20:46:46.415731 IP COMP3134-2025.ssh > 52.169.25.196.39274: Flags [P.], seq 1759:1811, ack 1249, win 502, options [nop,nop,TS val 241738554 ecr 2389145664], length 52
20:46:46.497792 IP 52.169.25.196.39274 > COMP3134-2025.ssh: Flags [P.], seq 1249:1317, ack 1811, win 541, options [nop,nop,TS val 2389145746 ecr 241738554], length 68
20:46:46.519665 IP COMP3134-2025.ssh > 52.169.25.196.39274: Flags [P.], seq 1811:1863, ack 1317, win 502, options [nop,nop,TS val 241738658 ecr 2389145746], length 52
20:46:46.615621 IP 52.169.25.196.39274 > COMP3134-2025.ssh: Flags [P.], seq 1317:1401, ack 1863, win 541, options [nop,nop,TS val 2389145864 ecr 241738658], length 84
20:46:46.658024 IP COMP3134-2025.ssh > 52.169.25.196.39274: Flags [.], ack 1401, win 502, options [nop,nop,TS val 241738797 ecr 2389145864], length 0
20:46:49.378152 IP COMP3134-2025.ssh > 52.169.25.196.39274: Flags [P.], seq 1863:1915, ack 1401, win 502, options [nop,nop,TS val 241741517 ecr 2389145864], length 52
20:46:49.463626 IP 52.169.25.196.39274 > COMP3134-2025.ssh: Flags [F.], seq 1401, ack 1915, win 541, options [nop,nop,TS val 2389148712 ecr 241741517], length 0
20:46:49.464948 IP COMP3134-2025.ssh > 52.169.25.196.39274: Flags [F.], seq 1915, ack 1402, win 502, options [nop,nop,TS val 241741603 ecr 2389148712], length 0
20:46:49.545256 IP 52.169.25.196.39274 > COMP3134-2025.ssh: Flags [.], ack 1916, win 541, options [nop,nop,TS val 2389148793 ecr 241741603], length 0
20:46:52.547533 IP 162.243.188.66.11788 > COMP3134-2025.ssh: Flags [.], ack 368, win 4978, options [nop,nop,TS val 3082547755 ecr 3964576690], length 0
20:46:52.547588 IP COMP3134-2025.ssh > 162.243.188.66.11788: Flags [.], ack 1, win 501, options [nop,nop,TS val 3964591820 ecr 3082532640], length 0
20:46:52.801089 IP 118.149.216.162.bc.googleusercontent.com.54528 > COMP3134-2025.22083: Flags [S], seq 2003375415, win 65535, options [mss 1460], length 0
20:46:54.202492 IP recyber.net.53811 > COMP3134-2025.11078: Flags [S], seq 821821463, win 1025, options [mss 1460], length 0
20:46:58.160273 IP 112.196.28.139.48570 > COMP3134-2025.ssh: Flags [S], seq 3754341047, win 64240, options [mss 1460,sackOK,TS val 293951308 ecr 0,nop,wscale 7], length 0
20:46:58.160347 IP COMP3134-2025.ssh > 112.196.28.139.48570: Flags [S.], seq 18224773, ack 3754341048, win 65160, options [mss 1460,sackOK,TS val 2293001468 ecr 293951308,nop,wscale 7], length 0
20:46:58.402579 IP 112.196.28.139.48570 > COMP3134-2025.ssh: Flags [.], ack 1, win 502, options [nop,nop,TS val 293951551 ecr 2293001468], length 0
20:46:58.402579 IP 112.196.28.139.48570 > COMP3134-2025.ssh: Flags [P.], seq 1:23, ack 1, win 502, options [nop,nop,TS val 293951551 ecr 2293001468], length 22: SSH: SSH-2.0-libssh_0.9.6
20:46:58.402668 IP COMP3134-2025.ssh > 112.196.28.139.48570: Flags [.], ack 23, win 509, options [nop,nop,TS val 2293001710 ecr 293951551], length 0
20:46:58.413768 IP COMP3134-2025.ssh > 112.196.28.139.48570: Flags [P.], seq 1:43, ack 23, win 509, options [nop,nop,TS val 2293001721 ecr 293951551], length 42: SSH: SSH-2.0-OpenSSH_8.9p1 Ubuntu-3ubuntu0.10
20:46:58.655513 IP 112.196.28.139.48570 > COMP3134-2025.ssh: Flags [.], ack 43, win 502, options [nop,nop,TS val 293951804 ecr 2293001721], length 0
20:46:58.655569 IP COMP3134-2025.ssh > 112.196.28.139.48570: Flags [P.], seq 43:1155, ack 23, win 509, options [nop,nop,TS val 2293001963 ecr 293951804], length 1112
20:46:58.656224 IP 112.196.28.139.48570 > COMP3134-2025.ssh: Flags [P.], seq 23:999, ack 43, win 502, options [nop,nop,TS val 293951805 ecr 2293001721], length 976
20:46:58.698323 IP COMP3134-2025.ssh > 112.196.28.139.48570: Flags [.], ack 999, win 502, options [nop,nop,TS val 2293002006 ecr 293951805], length 0
20:46:58.938223 IP 112.196.28.139.48570 > COMP3134-2025.ssh: Flags [.], ack 1155, win 501, options [nop,nop,TS val 293952087 ecr 2293001963], length 0
20:46:58.940014 IP 112.196.28.139.48570 > COMP3134-2025.ssh: Flags [P.], seq 999:1047, ack 1155, win 501, options [nop,nop,TS val 293952088 ecr 2293002006], length 48
20:46:58.940054 IP COMP3134-2025.ssh > 112.196.28.139.48570: Flags [.], ack 1047, win 502, options [nop,nop,TS val 2293002248 ecr 293952088], length 0
20:46:58.946398 IP COMP3134-2025.ssh > 112.196.28.139.48570: Flags [P.], seq 1155:1687, ack 1047, win 502, options [nop,nop,TS val 2293002254 ecr 293952088], length 532
20:46:59.188071 IP 112.196.28.139.48570 > COMP3134-2025.ssh: Flags [.], ack 1687, win 501, options [nop,nop,TS val 293952336 ecr 2293002254], length 0
20:46:59.188218 IP 112.196.28.139.48570 > COMP3134-2025.ssh: Flags [P.], seq 1047:1063, ack 1687, win 501, options [nop,nop,TS val 293952337 ecr 2293002254], length 16
20:46:59.230047 IP COMP3134-2025.ssh > 112.196.28.139.48570: Flags [.], ack 1063, win 502, options [nop,nop,TS val 2293002538 ecr 293952337], length 0
20:46:59.471961 IP 112.196.28.139.48570 > COMP3134-2025.ssh: Flags [P.], seq 1063:1115, ack 1687, win 501, options [nop,nop,TS val 293952620 ecr 2293002538], length 52
20:46:59.472028 IP COMP3134-2025.ssh > 112.196.28.139.48570: Flags [.], ack 1115, win 502, options [nop,nop,TS val 2293002780 ecr 293952620], length 0
20:46:59.472178 IP COMP3134-2025.ssh > 112.196.28.139.48570: Flags [P.], seq 1687:1739, ack 1115, win 502, options [nop,nop,TS val 2293002780 ecr 293952620], length 52
20:46:59.713879 IP 112.196.28.139.48570 > COMP3134-2025.ssh: Flags [P.], seq 1115:1199, ack 1739, win 501, options [nop,nop,TS val 293952862 ecr 2293002780], length 84
20:46:59.754030 IP COMP3134-2025.ssh > 112.196.28.139.48570: Flags [.], ack 1199, win 502, options [nop,nop,TS val 2293003062 ecr 293952862], length 0
20:47:01.318491 IP 95.210.203.35.bc.googleusercontent.com.50059 > COMP3134-2025.10398: Flags [S], seq 2588905112, win 65535, options [mss 1460], length 0
20:47:01.463834 IP COMP3134-2025.ssh > 112.196.28.139.48570: Flags [P.], seq 1739:1791, ack 1199, win 502, options [nop,nop,TS val 2293004771 ecr 293952862], length 52
20:47:01.705664 IP 112.196.28.139.48570 > COMP3134-2025.ssh: Flags [P.], seq 1199:1251, ack 1791, win 501, options [nop,nop,TS val 293954854 ecr 2293004771], length 52
20:47:01.705664 IP 112.196.28.139.48570 > COMP3134-2025.ssh: Flags [F.], seq 1251, ack 1791, win 501, options [nop,nop,TS val 293954854 ecr 2293004771], length 0
20:47:01.705740 IP COMP3134-2025.ssh > 112.196.28.139.48570: Flags [.], ack 1251, win 502, options [nop,nop,TS val 2293005013 ecr 293954854], length 0
20:47:01.707509 IP COMP3134-2025.ssh > 112.196.28.139.48570: Flags [F.], seq 1791, ack 1252, win 502, options [nop,nop,TS val 2293005015 ecr 293954854], length 0
20:47:01.949267 IP 112.196.28.139.48570 > COMP3134-2025.ssh: Flags [.], ack 1792, win 501, options [nop,nop,TS val 293955098 ecr 2293005015], length 0
20:47:05.254708 IP routeoptimizer.noc.liquidweb.com > COMP3134-2025: ICMP echo request, id 28936, seq 26633, length 48
20:47:05.254770 IP COMP3134-2025 > routeoptimizer.noc.liquidweb.com: ICMP echo reply, id 28936, seq 26633, length 48
20:47:05.466490 IP 67.43.14.13 > COMP3134-2025: ICMP echo request, id 11331, seq 26922, length 48
20:47:05.466544 IP COMP3134-2025 > 67.43.14.13: ICMP echo reply, id 11331, seq 26922, length 48
20:47:05.654589 IP routeoptimizer.noc.liquidweb.com.28777 > COMP3134-2025.33434: UDP, length 40
20:47:05.867075 IP 67.43.14.13.63451 > COMP3134-2025.33434: UDP, length 40
20:47:05.969605 IP security.criminalip.com.39748 > COMP3134-2025.1982: Flags [S], seq 2309895304, win 65535, options [mss 1460], length 0
20:47:06.727642 IP routeoptimizer.noc.liquidweb.com.28996 > COMP3134-2025.33434: Flags [S], seq 0:30, win 14600, options [mss 1460,sackOK,nop,wscale 7,eol], length 30
20:47:06.815666 IP 67.43.14.13.27114 > COMP3134-2025.33434: Flags [S], seq 0:30, win 14600, options [mss 1460,sackOK,nop,wscale 7,eol], length 30
20:47:07.655631 IP 162.243.188.66.11788 > COMP3134-2025.ssh: Flags [.], ack 368, win 4978, options [nop,nop,TS val 3082562863 ecr 3964591820], length 0
20:47:07.655688 IP COMP3134-2025.ssh > 162.243.188.66.11788: Flags [.], ack 1, win 501, options [nop,nop,TS val 3964606928 ecr 3082532640], length 0
20:47:18.932680 IP 52.169.25.196.46308 > COMP3134-2025.ssh: Flags [S], seq 3149425568, win 64240, options [mss 1440,sackOK,TS val 2389178180 ecr 0,nop,wscale 7], length 0
20:47:18.932756 IP COMP3134-2025.ssh > 52.169.25.196.46308: Flags [S.], seq 3461407069, ack 3149425569, win 65160, options [mss 1460,sackOK,TS val 241771071 ecr 2389178180,nop,wscale 7], length 0
20:47:19.016911 IP 52.169.25.196.46308 > COMP3134-2025.ssh: Flags [.], ack 1, win 502, options [nop,nop,TS val 2389178265 ecr 241771071], length 0
20:47:19.027825 IP COMP3134-2025.ssh > 52.169.25.196.46308: Flags [P.], seq 1:43, ack 1, win 510, options [nop,nop,TS val 241771166 ecr 2389178265], length 42: SSH: SSH-2.0