root@COMP3134-2025:~# ^[[200~tcpdump -i eth0 tcp~
tcpdump: command not found
root@COMP3134-2025:~# tcpdump -i eth0 tcp
tcpdump: verbose output suppressed, use -v[v]... for full protocol decode
listening on eth0, link-type EN10MB (Ethernet), snapshot length 262144 bytes
20:51:57.306991 IP COMP3134-2025.ssh > 162.243.188.66.11788: Flags [P.], seq 1732348852:1732348964, ack 3081667288, win 501, options [nop,nop,TS val 3964896580 ecr 3082852511], length 112
20:51:57.308268 IP COMP3134-2025.ssh > 162.243.188.66.11788: Flags [P.], seq 112:240, ack 1, win 501, options [nop,nop,TS val 3964896581 ecr 3082852511], length 128
20:51:57.308322 IP COMP3134-2025.ssh > 162.243.188.66.11788: Flags [P.], seq 240:304, ack 1, win 501, options [nop,nop,TS val 3964896581 ecr 3082852511], length 64
20:51:57.308359 IP COMP3134-2025.ssh > 162.243.188.66.11788: Flags [P.], seq 304:384, ack 1, win 501, options [nop,nop,TS val 3964896581 ecr 3082852511], length 80
20:51:57.308393 IP COMP3134-2025.ssh > 162.243.188.66.11788: Flags [P.], seq 384:464, ack 1, win 501, options [nop,nop,TS val 3964896581 ecr 3082852511], length 80
20:51:57.308426 IP COMP3134-2025.ssh > 162.243.188.66.11788: Flags [P.], seq 464:544, ack 1, win 501, options [nop,nop,TS val 3964896581 ecr 3082852511], length 80
20:51:57.308455 IP COMP3134-2025.ssh > 162.243.188.66.11788: Flags [P.], seq 544:608, ack 1, win 501, options [nop,nop,TS val 3964896581 ecr 3082852511], length 64
20:51:57.321183 IP 162.243.188.66.11788 > COMP3134-2025.ssh: Flags [.], ack 112, win 4978, options [nop,nop,TS val 3082852530 ecr 3964896580], length 0
20:51:57.322420 IP 162.243.188.66.11788 > COMP3134-2025.ssh: Flags [.], ack 240, win 4978, options [nop,nop,TS val 3082852531 ecr 3964896581], length 0
20:51:57.322420 IP 162.243.188.66.11788 > COMP3134-2025.ssh: Flags [.], ack 304, win 4978, options [nop,nop,TS val 3082852531 ecr 3964896581], length 0
20:51:57.322595 IP 162.243.188.66.11788 > COMP3134-2025.ssh: Flags [.], ack 384, win 4978, options [nop,nop,TS val 3082852532 ecr 3964896581], length 0
20:51:57.322604 IP 162.243.188.66.11788 > COMP3134-2025.ssh: Flags [.], ack 464, win 4978, options [nop,nop,TS val 3082852532 ecr 3964896581], length 0
20:51:57.322690 IP 162.243.188.66.11788 > COMP3134-2025.ssh: Flags [.], ack 544, win 4978, options [nop,nop,TS val 3082852532 ecr 3964896581], length 0
20:51:57.322690 IP 162.243.188.66.11788 > COMP3134-2025.ssh: Flags [.], ack 608, win 4978, options [nop,nop,TS val 3082852532 ecr 3964896581], length 0
20:51:57.406884 IP COMP3134-2025.41914 > 67.207.67.3.domain: Flags [S], seq 1941111113, win 64240, options [mss 1460,sackOK,TS val 3479064220 ecr 0,nop,wscale 7,tfo  cookiereq,nop,nop], length 0
20:51:57.408491 IP 67.207.67.3.domain > COMP3134-2025.41914: Flags [S.], seq 1219036169, ack 1941111114, win 65160, options [mss 1460,sackOK,TS val 4051057773 ecr 3479064220,nop,wscale 9], length 0
20:51:57.408528 IP COMP3134-2025.41914 > 67.207.67.3.domain: Flags [.], ack 1, win 502, options [nop,nop,TS val 3479064222 ecr 4051057773], length 0
20:51:57.408564 IP COMP3134-2025.41914 > 67.207.67.3.domain: Flags [P.], seq 1:48, ack 1, win 502, options [nop,nop,TS val 3479064222 ecr 4051057773], length 47 21415+ PTR? 66.188.243.162.in-addr.arpa. (45)
20:51:57.408891 IP 67.207.67.3.domain > COMP3134-2025.41914: Flags [.], ack 48, win 128, options [nop,nop,TS val 4051057774 ecr 3479064222], length 0
20:51:57.409162 IP 67.207.67.3.domain > COMP3134-2025.41914: Flags [P.], seq 1:115, ack 48, win 128, options [nop,nop,TS val 4051057774 ecr 3479064222], length 114 21415 NXDomain 0/1/0 (112)
20:51:57.409169 IP COMP3134-2025.41914 > 67.207.67.3.domain: Flags [.], ack 115, win 502, options [nop,nop,TS val 3479064223 ecr 4051057774], length 0
20:51:57.410428 IP COMP3134-2025.ssh > 162.243.188.66.11788: Flags [P.], seq 608:848, ack 1, win 501, options [nop,nop,TS val 3964896683 ecr 3082852532], length 240
20:51:57.410499 IP COMP3134-2025.ssh > 162.243.188.66.11788: Flags [P.], seq 848:912, ack 1, win 501, options [nop,nop,TS val 3964896683 ecr 3082852532], length 64
20:51:57.410549 IP COMP3134-2025.ssh > 162.243.188.66.11788: Flags [P.], seq 912:1136, ack 1, win 501, options [nop,nop,TS val 3964896683 ecr 3082852532], length 224
20:51:57.410579 IP COMP3134-2025.ssh > 162.243.188.66.11788: Flags [P.], seq 1136:1200, ack 1, win 501, options [nop,nop,TS val 3964896683 ecr 3082852532], length 64
20:51:57.410620 IP COMP3134-2025.ssh > 162.243.188.66.11788: Flags [P.], seq 1200:1424, ack 1, win 501, options [nop,nop,TS val 3964896683 ecr 3082852532], length 224
20:51:57.410663 IP COMP3134-2025.ssh > 162.243.188.66.11788: Flags [P.], seq 1424:1488, ack 1, win 501, options [nop,nop,TS val 3964896683 ecr 3082852532], length 64
20:51:57.410718 IP COMP3134-2025.ssh > 162.243.188.66.11788: Flags [P.], seq 1488:1712, ack 1, win 501, options [nop,nop,TS val 3964896683 ecr 3082852532], length 224
20:51:57.410782 IP COMP3134-2025.ssh > 162.243.188.66.11788: Flags [P.], seq 1712:2000, ack 1, win 501, options [nop,nop,TS val 3964896683 ecr 3082852532], length 288
20:51:57.410814 IP COMP3134-2025.ssh > 162.243.188.66.11788: Flags [P.], seq 2000:2064, ack 1, win 501, options [nop,nop,TS val 3964896683 ecr 3082852532], length 64
20:51:57.410853 IP COMP3134-2025.ssh > 162.243.188.66.11788: Flags [P.], seq 2064:2288, ack 1, win 501, options [nop,nop,TS val 3964896683 ecr 3082852532], length 224
20:51:57.410883 IP COMP3134-2025.ssh > 162.243.188.66.11788: Flags [P.], seq 2288:2352, ack 1, win 501, options [nop,nop,TS val 3964896683 ecr 3082852532], length 64
20:51:57.410921 IP COMP3134-2025.ssh > 162.243.188.66.11788: Flags [P.], seq 2352:2576, ack 1, win 501, options [nop,nop,TS val 3964896683 ecr 3082852532], length 224
20:51:57.410949 IP COMP3134-2025.ssh > 162.243.188.66.11788: Flags [P.], seq 2576:2640, ack 1, win 501, options [nop,nop,TS val 3964896683 ecr 3082852532], length 64
20:51:57.410986 IP COMP3134-2025.ssh > 162.243.188.66.11788: Flags [P.], seq 2640:2848, ack 1, win 501, options [nop,nop,TS val 3964896684 ecr 3082852532], length 208
20:51:57.424668 IP 162.243.188.66.11788 > COMP3134-2025.ssh: Flags [.], ack 848, win 4978, options [nop,nop,TS val 3082852634 ecr 3964896683], length 0
20:51:57.424668 IP 162.243.188.66.11788 > COMP3134-2025.ssh: Flags [.], ack 912, win 4978, options [nop,nop,TS val 3082852634 ecr 3964896683], length 0
20:51:57.424668 IP 162.243.188.66.11788 > COMP3134-2025.ssh: Flags [.], ack 1136, win 4978, options [nop,nop,TS val 3082852634 ecr 3964896683], length 0
20:51:57.424732 IP COMP3134-2025.ssh > 162.243.188.66.11788: Flags [P.], seq 2848:4544, ack 1, win 501, options [nop,nop,TS val 3964896697 ecr 3082852634], length 1696